{
  "$schema": "https://json-schema.org/draft/2020-12/schema",
  "$id": "https://schemas.juniorbay.com/stripe-link/Product.schema.json",
  "title": "Product",
  "type": "object",
  "additionalProperties": false,
  "required": [
    "schema_version",
    "document_type",
    "tenant_id",
    "product_id",
    "stripe_product_id",
    "canonical",
    "status",
    "name",
    "prices",
    "default_price_id",
    "fulfillment",
    "sync",
    "tags"
  ],
  "properties": {
    "schema_version": {
      "type": "string",
      "const": "2026-05-29"
    },
    "document_type": {
      "type": "string",
      "const": "product"
    },
    "tenant_id": {
      "type": "string",
      "minLength": 1
    },
    "product_id": {
      "type": "string",
      "minLength": 1
    },
    "stripe_product_id": {
      "type": [
        "string",
        "null"
      ],
      "description": "Stripe product ID after synchronization. Null for local products that have not synced yet."
    },
    "stripe_mode": {
      "type": "string",
      "enum": [
        "test",
        "live"
      ]
    },
    "canonical": {
      "type": "boolean",
      "description": "True only after this product shape is accepted as canonical by the API."
    },
    "status": {
      "type": "string",
      "enum": [
        "active",
        "archived"
      ],
      "description": "Product lifecycle status. Archived products are hidden from the default active product list."
    },
    "name": {
      "type": "string",
      "minLength": 1
    },
    "description": {
      "type": "string"
    },
    "images": {
      "type": "array",
      "description": "Canonical product imagery. Offer-specific bundle/composite presentation images can override this from Offer items.",
      "items": {
        "type": "string",
        "format": "uri-reference"
      },
      "default": []
    },
    "product_intent": {
      "type": "string",
      "enum": [
        "transaction",
        "lead_gen"
      ]
    },
    "product_type": {
      "type": "string"
    },
    "product_category": {
      "type": "string",
      "minLength": 1
    },
    "sku": {
      "type": "string",
      "minLength": 1,
      "description": "Merchant-specific stock keeping unit. Optional; when absent, structured data falls back to product_id as the identifier."
    },
    "unit_cost": {
      "type": "integer",
      "minimum": 0,
      "description": "What the tenant PAID to acquire one unit, in the smallest currency unit. Cost of goods, not a sale price. ABSENT MEANS UNKNOWN, never zero: the ledger reports profit only when every line of a sale has one, because a missing cost silently inflates margin. A planned InventoryLot (plans/INVENTORY_COST_BASIS.md) would derive this from a batch; today the tenant types it."
    },
    "condition": {
      "type": "string",
      "enum": [
        "new",
        "refurbished",
        "used",
        "damaged"
      ],
      "default": "new",
      "description": "Drives schema.org itemCondition. Stated rather than assumed: markup may only claim a condition the tenant chose."
    },
    "refund_policy": {
      "type": "object",
      "additionalProperties": false,
      "description": "Product-level refund policy. RESOLVED server-side by domain/refund_policy.py: a deliberate product override outranks the tenant default for the product class, which outranks the platform fallback. A policy whose source is a retired user_preference* value is the old dashboard literal and is NOT treated as an override.",
      "required": [
        "source",
        "short_label",
        "full_policy"
      ],
      "properties": {
        "source": {
          "type": "string",
          "enum": [
            "platform_default",
            "tenant_default",
            "product_override",
            "tip_jar_default",
            "user_preference_default",
            "user_preferences.physical_products"
          ],
          "description": "Where this policy came from. `platform_default` means nobody chose -- the platform's fallback, and the honest answer the old code could not give. `tip_jar_default` was already being written by handlers/tip_jar_provision.py without being listed here. The `user_preference*` values are RETIRED (plans/REFUND_POLICY.md) and stay valid only so existing documents still read; nothing should write them."
        },
        "refund_window": {
          "type": "string",
          "enum": [
            "non_refundable",
            "72_hours",
            "7_days",
            "14_days",
            "30_days",
            "60_days",
            "custom"
          ]
        },
        "condition": {
          "type": "string",
          "enum": [
            "any",
            "unused",
            "unopened",
            "defective_only",
            "not_downloaded",
            "custom"
          ]
        },
        "return_method": {
          "type": "string",
          "enum": [
            "no_return_customer_keeps",
            "return_required",
            "digital_revoke_access",
            "custom"
          ]
        },
        "short_label": {
          "type": "string"
        },
        "full_policy": {
          "type": "string"
        },
        "keep_it_below": {
          "type": "integer",
          "minimum": 0,
          "description": "Below this order value (cents), a refund that would normally require a physical return is granted without one. Return postage above the item's worth loses money, and a buyer held waiting files a chargeback that costs more than the refund."
        }
      }
    },
    "lead_capture": {
      "type": "object",
      "additionalProperties": false,
      "required": [
        "action",
        "title",
        "description"
      ],
      "properties": {
        "action": {
          "type": "string",
          "enum": [
            "capture_email",
            "capture_phone",
            "capture_email_phone",
            "call_number",
            "external_url",
            "social_redirect"
          ]
        },
        "title": {
          "type": "string",
          "minLength": 1
        },
        "description": {
          "type": "string",
          "minLength": 1
        },
        "fields": {
          "type": "array",
          "items": {
            "type": "object",
            "additionalProperties": false,
            "required": [
              "name",
              "type",
              "required"
            ],
            "properties": {
              "name": {
                "type": "string",
                "minLength": 1
              },
              "type": {
                "type": "string",
                "minLength": 1
              },
              "required": {
                "type": "boolean"
              }
            }
          }
        },
        "target": {
          "type": "object",
          "additionalProperties": false,
          "required": [
            "type"
          ],
          "properties": {
            "type": {
              "type": "string",
              "enum": [
                "phone",
                "url",
                "form",
                "social"
              ]
            },
            "value": {
              "type": "string"
            },
            "form_id": {
              "type": "string"
            },
            "platform": {
              "type": "string"
            },
            "open": {
              "type": "string",
              "enum": [
                "new_tab",
                "same_tab",
                "modal"
              ]
            }
          }
        }
      }
    },
    "variants": {
      "type": "object",
      "additionalProperties": false,
      "properties": {
        "size_enabled": {
          "type": "boolean",
          "default": false
        },
        "color_enabled": {
          "type": "boolean",
          "default": false
        },
        "sizes": {
          "type": "array",
          "items": {
            "oneOf": [
              {
                "type": "string"
              },
              {
                "type": "object",
                "additionalProperties": false,
                "properties": {
                  "label": {
                    "type": "string"
                  },
                  "description": {
                    "type": "string"
                  }
                }
              }
            ]
          },
          "default": []
        },
        "colors": {
          "type": "array",
          "items": {
            "oneOf": [
              {
                "type": "string"
              },
              {
                "type": "object",
                "additionalProperties": false,
                "properties": {
                  "label": {
                    "type": "string"
                  },
                  "hex_color": {
                    "type": "string",
                    "pattern": "^#[0-9a-fA-F]{6}$"
                  },
                  "description": {
                    "type": "string"
                  }
                }
              }
            ]
          },
          "default": []
        }
      }
    },
    "stripe_metadata": {
      "type": "object",
      "additionalProperties": {
        "type": [
          "string",
          "number",
          "integer",
          "boolean",
          "null"
        ]
      }
    },
    "prices": {
      "type": "array",
      "minItems": 1,
      "items": {
        "$ref": "Price.schema.json"
      }
    },
    "default_price_id": {
      "type": "string",
      "minLength": 1
    },
    "fulfillment": {
      "type": "object",
      "additionalProperties": false,
      "required": [
        "requires_shipping",
        "ship_from",
        "weight_lb",
        "dimensions"
      ],
      "properties": {
        "requires_shipping": {
          "type": "boolean"
        },
        "ship_from": {
          "oneOf": [
            {
              "type": "null"
            },
            {
              "type": "object",
              "additionalProperties": true
            }
          ]
        },
        "weight_lb": {
          "type": [
            "number",
            "null"
          ],
          "minimum": 0
        },
        "dimensions": {
          "type": "object",
          "additionalProperties": false,
          "required": [
            "length_in",
            "width_in",
            "height_in"
          ],
          "properties": {
            "length_in": {
              "type": [
                "number",
                "null"
              ],
              "minimum": 0
            },
            "width_in": {
              "type": [
                "number",
                "null"
              ],
              "minimum": 0
            },
            "height_in": {
              "type": [
                "number",
                "null"
              ],
              "minimum": 0
            }
          },
          "description": "The BOX this product ships in, when the tenant declares one. An override, not a measurement: it wins for a single-item order because the seller knows their own operation. It cannot be summed across a bundle -- boxes do not add -- which is what item_dimensions is for."
        },
        "item_dimensions": {
          "description": "The PRODUCT's own size, so several items can be packed into one box. Without it a multi-item order falls back to one parcel per item, which over-estimates. Absent is normal: a tenant who only ever ships one thing at a time never needs it.",
          "oneOf": [
            {
              "type": "null"
            },
            {
              "type": "object",
              "additionalProperties": false,
              "required": [
                "length_in",
                "width_in",
                "height_in"
              ],
              "properties": {
                "length_in": {
                  "type": [
                    "number",
                    "null"
                  ],
                  "exclusiveMinimum": 0
                },
                "width_in": {
                  "type": [
                    "number",
                    "null"
                  ],
                  "exclusiveMinimum": 0
                },
                "height_in": {
                  "type": [
                    "number",
                    "null"
                  ],
                  "exclusiveMinimum": 0
                },
                "weight_lb": {
                  "description": "What the product weighs BARE, out of its packaging. Distinct from fulfillment.weight_lb, which is the weight shipped in its own box. Summing the packed weight when several items share one box billed the packaging once per item -- about 15% over on three items.",
                  "type": [
                    "number",
                    "null"
                  ],
                  "minimum": 0
                }
              }
            }
          ]
        },
        "compressible": {
          "description": "Whether this item squashes. A foil pouch goes into a padded mailer thicker than the mailer's flat measurement; a rigid jar of identical dimensions does not. Two items the same size pack completely differently depending on which they are, and only the tenant knows. Default false -- rigid is the safe assumption, because letting a rigid item into an envelope fails at the counter after the label is paid for.",
          "type": [
            "boolean",
            "null"
          ]
        },
        "ships_alone": {
          "description": "Whether this item always ships in its own box, whatever else is in the order. The escape hatch for what dimensions cannot predict: something fragile needing void fill far beyond its size, a rolled poster, an item in manufacturer packaging. Default false -- otherwise a declared box would swallow the rest of the order, which is what the packer used to do.",
          "type": [
            "boolean",
            "null"
          ]
        }
      }
    },
    "sync": {
      "type": "object",
      "additionalProperties": false,
      "required": [
        "status",
        "last_synced_at",
        "error"
      ],
      "properties": {
        "status": {
          "type": [
            "string",
            "null"
          ],
          "enum": [
            "pending",
            "success",
            "failed",
            "drift",
            "not_applicable",
            null
          ]
        },
        "last_synced_at": {
          "type": [
            "integer",
            "null"
          ],
          "minimum": 0
        },
        "error": {
          "type": [
            "string",
            "null"
          ]
        }
      }
    },
    "digital_asset": {
      "type": "object",
      "additionalProperties": false,
      "description": "Downloadable file for a digital product, stored privately in the media bucket. Presence marks the product as digital; buyers receive a purchase-verified download link.",
      "required": [
        "asset_id",
        "bucket_key",
        "filename"
      ],
      "properties": {
        "asset_id": {
          "type": "string",
          "minLength": 1
        },
        "bucket_key": {
          "type": "string",
          "minLength": 1,
          "description": "S3 key in the media bucket, e.g. downloads/{tenant_id}/{product_id}/{asset_id}/{filename}."
        },
        "filename": {
          "type": "string",
          "minLength": 1
        },
        "content_type": {
          "type": "string"
        },
        "size_bytes": {
          "type": "integer",
          "minimum": 0
        },
        "uploaded_at": {
          "type": "integer",
          "minimum": 0
        }
      }
    },
    "created_at": {
      "type": "integer",
      "minimum": 0
    },
    "updated_at": {
      "type": "integer",
      "minimum": 0
    },
    "tags": {
      "type": "array",
      "description": "Search and catalog tags. The dashboard auto-generates baseline tags from product name, product type, and category; tenants can add custom tags.",
      "items": {
        "type": "string"
      },
      "default": []
    },
    "ai_context": {
      "type": "object",
      "description": "What the AI is LICENSED to say about this product (plans/AI_PAGE_BRIEF.md v2 \u00a74). Optional and additive: every field here is a fact the field floor will permit a generated page to assert, and anything absent is a sentence the AI may not write. Lives on the PRODUCT rather than the page because these describe the thing being sold, so a second page for it -- an A/B variant, a seasonal landing page -- inherits them instead of asking again.",
      "additionalProperties": false,
      "properties": {
        "audience": {
          "type": "string",
          "maxLength": 500,
          "description": "Who it is for. Required by the fork step: without it the copy addresses nobody."
        },
        "facts": {
          "type": "array",
          "maxItems": 25,
          "items": {
            "type": "string",
            "minLength": 1,
            "maxLength": 500
          },
          "description": "What people should know. The substance the floor grounds every claim against."
        },
        "evidence": {
          "type": "string",
          "maxLength": 1000,
          "description": "What backs an efficacy claim. The ONLY licence for one -- absent means the AI may not make any."
        },
        "certifications": {
          "type": "array",
          "maxItems": 15,
          "items": {
            "type": "string",
            "minLength": 1,
            "maxLength": 200
          }
        },
        "tone": {
          "type": "string",
          "maxLength": 40,
          "description": "Voice. Absent falls back to the category's default rather than to the model's taste."
        },
        "must_say": {
          "type": "array",
          "maxItems": 15,
          "items": {
            "type": "string",
            "minLength": 1,
            "maxLength": 300
          }
        },
        "must_not_say": {
          "type": "array",
          "maxItems": 15,
          "items": {
            "type": "string",
            "minLength": 1,
            "maxLength": 300
          }
        },
        "updated_at": {
          "type": "integer",
          "minimum": 0
        },
        "ships_from_us": {
          "type": "boolean",
          "description": "The tenant confirming this product ships from the United States. Drives a trust badge; asked rather than assumed, because origin is a checkable claim."
        },
        "money_back_badge": {
          "type": "boolean",
          "description": "The tenant opting into a money-back trust badge. Only meaningful when a refund policy exists -- the badge is labelled from THAT, never from a platform default."
        }
      }
    }
  }
}
