{
  "schema_version": "2026-05-29",
  "document_type": "product",
  "tenant_id": "tenant_demo",
  "product_id": "prod_creatine_gummies",
  "stripe_product_id": null,
  "stripe_mode": "test",
  "canonical": false,
  "status": "active",
  "name": "Creatine Gummies",
  "description": "Creatine gummies with one canonical Stripe product and multiple Stripe prices.",
  "images": [
    "https://example.com/images/creatine-gummies.webp"
  ],
  "product_type": "physical",
  "product_category": "creatine",
  "prices": [
    {
      "price_id": "price_1bottle",
      "stripe_price_id": null,
      "currency": "usd",
      "unit_amount": 3900,
      "tenant_keyed_amount": 3900,
      "quantity": 1,
      "context": "standard"
    },
    {
      "price_id": "price_2bottle",
      "stripe_price_id": null,
      "currency": "usd",
      "unit_amount": 6700,
      "tenant_keyed_amount": 6700,
      "quantity": 2,
      "badge": "Most Popular",
      "context": "standard",
      "discount_pct": 15
    },
    {
      "price_id": "price_3bottle",
      "stripe_price_id": null,
      "currency": "usd",
      "unit_amount": 8900,
      "tenant_keyed_amount": 8900,
      "quantity": 3,
      "context": "standard",
      "discount_pct": 24
    },
    {
      "price_id": "price_6bottle",
      "stripe_price_id": null,
      "currency": "usd",
      "unit_amount": 14900,
      "tenant_keyed_amount": 14900,
      "quantity": 6,
      "badge": "Best Value",
      "context": "standard",
      "discount_pct": 36
    },
    {
      "price_id": "price_upsell_1bottle",
      "stripe_price_id": null,
      "currency": "usd",
      "unit_amount": 2700,
      "tenant_keyed_amount": 2700,
      "quantity": 1,
      "context": "upsell"
    }
  ],
  "default_price_id": "price_2bottle",
  "fulfillment": {
    "requires_shipping": true,
    "ship_from": null,
    "weight_lb": null,
    "dimensions": {
      "length_in": null,
      "width_in": null,
      "height_in": null
    }
  },
  "sync": {
    "status": "pending",
    "last_synced_at": null,
    "error": null
  },
  "created_at": 1780092000,
  "updated_at": 1780092000,
  "tags": ["creatine gummies", "creatine", "gummies", "physical", "supplement"]
}
